{
  "id": "550e8400-e29b-41d4-a716-446655440002",
  "name": {
    "given": "Alice",
    "family": "Johnson",
    "display": "Alice Johnson"
  },
  "emails": [
    {
      "address": "alice@example.com",
      "type": "work",
      "primary": true
    }
  ],
  "phones": [
    {
      "number": "+61 400 123 456",
      "type": "mobile"
    }
  ],
  "addresses": [
    {
      "street": "123 Main St",
      "city": "Sydney",
      "state": "NSW",
      "postcode": "2000",
      "country": "Australia"
    }
  ],
  "organisation": "Acme Corp",
  "source": "test",
  "source_id": "test-contact-001",
  "extensions": {
    "com.google.contacts": {
      "resource_name": "people/c12345"
    }
  },
  "created_at": "2026-01-15T10:30:00Z",
  "updated_at": "2026-01-15T10:30:00Z"
}
